{
  "schema_version": "m2-synthetic-import-db.v1",
  "source_kind": "synthetic_fixture",
  "records": [
    {
      "record_id": "synthetic.m2.line.001",
      "line_id": "synthetic.m2.line.001",
      "conversation_id": "synthetic.m2.conversation.001",
      "speaker_id": "synthetic.m2.speaker.clerk",
      "speaker_label": "synthetic_clerk",
      "context_placeholder": "synthetic_office_entry",
      "source_text": "The paper umbrella requested a receipt before agreeing to open.",
      "context_tags": [
        "synthetic-office",
        "invented-entry"
      ],
      "redacted_metadata": {
        "fixture_only": true,
        "invented_text_only": true,
        "real_game_text": false
      }
    },
    {
      "record_id": "synthetic.m2.line.002",
      "line_id": "synthetic.m2.line.002",
      "conversation_id": "synthetic.m2.conversation.001",
      "speaker_id": "synthetic.m2.speaker.clerk",
      "speaker_label": "synthetic_clerk",
      "context_placeholder": "synthetic_office_reply",
      "source_text": "The clerk stamped the silence and placed it in an imaginary tray.",
      "context_tags": [
        "synthetic-office",
        "invented-reply"
      ],
      "redacted_metadata": {
        "fixture_only": true,
        "invented_text_only": true,
        "real_game_text": false
      }
    },
    {
      "record_id": "synthetic.m2.line.003",
      "line_id": "synthetic.m2.line.003",
      "conversation_id": "synthetic.m2.conversation.001",
      "speaker_id": "synthetic.m2.speaker.player",
      "speaker_label": "synthetic_player",
      "context_placeholder": "synthetic_office_option",
      "source_text": "Ask whether the tray has completed its paperwork.",
      "context_tags": [
        "synthetic-office",
        "invented-option"
      ],
      "redacted_metadata": {
        "fixture_only": true,
        "invented_text_only": true,
        "real_game_text": false
      }
    }
  ],
  "context_edges": [
    {
      "from_record_id": "synthetic.m2.line.002",
      "to_record_id": "synthetic.m2.line.001",
      "relation": "previous_visible"
    },
    {
      "from_record_id": "synthetic.m2.line.001",
      "to_record_id": "synthetic.m2.line.002",
      "relation": "nearby_branch"
    },
    {
      "from_record_id": "synthetic.m2.line.002",
      "to_record_id": "synthetic.m2.line.003",
      "relation": "player_option"
    }
  ],
  "metadata": {
    "fixture_only": true,
    "invented_text_only": true,
    "contract_only": true,
    "m2_import_locally_extracted_db_done": false,
    "m2_line_index_done": false,
    "m2_context_graph_done": false,
    "recommended_next_step": "m2_synthetic_import_validator_or_line_index_contract"
  },
  "safety_flags": {
    "real_game_text_included": false,
    "extracted_game_db_included": false,
    "private_input_read": false,
    "automatic_game_install_scanning": false,
    "arbitrary_drive_scanning": false,
    "game_files_read": false,
    "bepinex_logs_read": false,
    "screenshots_read": false,
    "ocr_used": false,
    "save_files_read": false,
    "decompiled_code_used": false,
    "current_line_capture_used": false,
    "ui_text_reading_used": false,
    "unity_scanning_used": false,
    "hooks_used": false,
    "provider_called": false,
    "companion_contract_changed": false,
    "extracted_text_committed": false,
    "generated_index_committed": false,
    "raw_payloads_included": false
  }
}

